{
  "report_version": "5",
  "provenance": {
    "hash_algorithm": "sha256",
    "inputs": {
      "config": { "sha256": "aaaaaaaaaaaaaaaaaaaaaaaaaaaaaaaaaaaaaaaaaaaaaaaaaaaaaaaaaaaaaaaa", "size_bytes": 128 },
      "primary": {
        "base": { "dataset": "synthetic-zones", "sha256": "bbbbbbbbbbbbbbbbbbbbbbbbbbbbbbbbbbbbbbbbbbbbbbbbbbbbbbbbbbbbbbbb", "size_bytes": 512 },
        "candidate": { "dataset": "synthetic-zones", "sha256": "cccccccccccccccccccccccccccccccccccccccccccccccccccccccccccccccc", "size_bytes": 514 }
      },
      "dependencies": [
        { "dataset": "synthetic-facilities", "sha256": "dddddddddddddddddddddddddddddddddddddddddddddddddddddddddddddddd", "size_bytes": 256 }
      ]
    },
    "engine": {
      "geoimpact_ci": "synthetic-fixture",
      "shapely": "synthetic-fixture",
      "geos": "synthetic-fixture",
      "pyproj": "synthetic-fixture",
      "proj": "synthetic-fixture"
    }
  },
  "analysis": {
    "crs": "EPSG:25830",
    "primary_dataset": "synthetic-zones",
    "primary_id_field": "zone_id",
    "dependencies": [
      { "dataset": "synthetic-facilities", "id_field": "facility_id", "predicate": "within" }
    ]
  },
  "primary_change": {
    "feature_geometry_status": { "zone-north": "modified", "zone-south": "unchanged" },
    "changed_feature_ids": ["zone-north"],
    "added_feature_ids": [],
    "removed_feature_ids": [],
    "modified_feature_ids": ["zone-north"],
    "changed_footprint_area_m2": 4.5,
    "changed_footprint_geometry": { "type": "Polygon", "coordinates": [[[500000, 4500000], [500003, 4500000], [500003, 4500001.5], [500000, 4500001.5], [500000, 4500000]]] },
    "max_boundary_displacement_m": 3.0
  },
  "relationships": [
    {
      "dependent_dataset": "synthetic-facilities",
      "dependent_id": "facility-01",
      "predicate": "within",
      "before": ["zone-north"],
      "after": [],
      "change_type": "assignment_lost"
    },
    {
      "dependent_dataset": "synthetic-facilities",
      "dependent_id": "facility-02",
      "predicate": "within",
      "before": ["zone-south"],
      "after": ["zone-south"],
      "change_type": "unchanged"
    }
  ],
  "relationship_regressions": [
    {
      "evidence_id": "synthetic-regression-01",
      "primary_dataset": "synthetic-zones",
      "primary_feature_ids": ["zone-north"],
      "dependent_dataset": "synthetic-facilities",
      "dependent_id": "facility-01",
      "predicate": "within",
      "before": ["zone-north"],
      "after": [],
      "change_type": "assignment_lost",
      "evidence_geometry_crs": "EPSG:25830",
      "evidence_geometry": { "type": "Point", "coordinates": [500001, 4500001] }
    }
  ],
  "boundary_ambiguities": [],
  "policy": {
    "rule": "max_relationship_regressions",
    "observed_value": 1,
    "threshold": 0,
    "evidence_ids": ["synthetic-regression-01"],
    "status": "BLOCK"
  },
  "verdict": "BLOCK"
}
